2022-08-25,Downtown Grand Hotel & Casino,Grand Deluxe King Bed Non-Smoking,US$45
2022-08-25,Ellis Island Hotel Casino & Brewery,Deluxe King Room - Non-Smoking,US$30
2022-08-25,Plaza Hotel & Casino,Deluxe Room,US$36
2022-08-25,"Motel 6-Las Vegas, NV - Tropicana",Queen Room,US$59
2022-08-25,Downtowner Boutique Hotel,Standard Queen Room,US$40
2022-08-25,Arizona Charlie's Boulder,Standard  Room with Two Double Beds,US$59
2022-08-25,Arizona Charlie's Decatur,Klondike Standard Room,US$49
2022-08-25,Best Western McCarran Inn,King Room - Non-Smoking,US$105
2022-08-25,Best Western Plus Henderson Hotel,Queen Room with Two Queen Beds and Walk-In Shower - Disability Access/Non-Smoking,US$89
2022-08-25,DoubleTree by Hilton Las Vegas East Flamingo,King Room with Roll-in Shower - Mobility/Hearing Accessible,US$119
2022-08-25,"Motel 6-Las Vegas, NV - I-15 Stadium",Quadruple Room,US$73
2022-08-25,Travelodge by Wyndham Las Vegas Airport Near The Strip,Queen Room with Two Queen Beds - Non-Smoking,US$89
2022-08-25,Embassy Suites by Hilton Convention Center Las Vegas,King Suite - Disability Access/Non-Smoking,US$139
2022-08-25,Hampton Inn Tropicana Las Vegas,King Room - Non-Smoking,US$119
2022-08-25,Skyline Hotel and Casino,Classic Full ,US$90
2022-08-25,Sonesta Simply Suites Las Vegas Convention Center,Queen Studio Suite with Roll-In Shower - Mobility Accessible,US$96
2022-08-25,La Quinta by Wyndham Las Vegas Airport N Conv.,Deluxe King Room,US$94
2022-08-25,"Hampton Inn Las Vegas Strip South, NV 89123",Queen Room with Two Queen Beds - Hearing Accessible/Non-Smoking,US$121
2022-08-25,Circa Resort & Casino - Adults Only,Single King ,US$139
2022-08-25,Thunderbird Boutique Hotel,Double Queen Room Accessible,US$39
2022-08-25,Hampton Inn & Suites Las Vegas Convention Center - No Resort Fee,Queen Room with Two Queen Beds - Hearing Accessible/Non-Smoking,US$122
2022-08-25,"Candlewood Suites - Las Vegas - E Tropicana, an IHG Hotel",Queen Studio with Two Queen Beds - Hearing Accessible - Non-Smoking,US$124
2022-08-25,La Quinta by Wyndham Las Vegas Summerlin Tech,Deluxe King Room,US$119
2022-08-25,Best Western Plus Casino Royale - Center Strip,Standard King Room (No Resort Fees + Free Parking),US$150
2022-08-25,Oasis at Gold Spike - Adults Only,Gold Spike Queen,US$34
